path,name,description,url
https://nknhb966.github.io/artest3/models/model02.glb,土師器,区画溝から土師器のお椀が出土している。,https://www.city.echizen.lg.jp/office/090/030/kokufu.html
https://nknhb966.github.io/artest3/models/model04.glb,緑釉陶器,盤に三つの足がついた器種。愛知県にある猿投窯で作られたもの。,https://www.city.echizen.lg.jp/office/090/030/kokufu.html
https://nknhb966.github.io/artest3/models/model09.glb,灯明皿,土師皿。皿の縁に炭化物が付着しており、灯明皿として使われていたものと思われる。,
https://echizencity.github.io/opendata/kokufuhakkutsu/00101_kokufuhakkutsu_small.glb,遺構2023,令和5年度（2023年度）に本興寺境内（国府1丁目地係）で実施した越前国府跡発掘調査では、平安時代の遺構が検出されました。特に、幅2m50cmの溝は国府に関連する官衙施設の区画溝の可能性があり、越前国府の所在地解明の足掛かりとなる成果になりました。,
./models/00101_kokufuhakkutsu_tenpct.glb,遺構2023(10パーセントスケール),,
